,0
415,"국가 또는 지방자치단체의 청사와 외국공관의 건축물로서 제1종 근린생활시설에 해당하지 않는 업무시설을 말한다. 업무시설은 공공업무시설 외에 일반업무시설이 있다. 일반업무시설은 금융업소, 사무소, 결혼상담소 등 소개업소, 출판사, 신문사 그 밖에 이와 비슷한 것으로 제2종 근린생활시설에 해당하지 않는 것, 오피스텔이 있다. 근거법은 건축법이다.(시행령 별표 참조)"
416,"환지방식(토지구획정리방식)으로 택지를 개발했을 때, 종전의 토지면적에서 환지 받은 면적을 뺀 나머지 토지면적의 비율을 말한다. 즉 감보된 면적의 비율을 말한다. 대개 사업장에 따라 다르나 20~60% 수준이다. 이같이 감보하는 것은 사업시행자(주체)가 도로·공원·상하수도·광장 같은 공공시설을 확보하기 위해 필요한 토지를 수익자(소유자)의 토지에서, 받을 사업비용 대신 토지를 조금씩 떼어내 상계시키기 때문이다. 이렇게 떼어 놓은 토지를 ‘체비지’라 한다. 사업시행 전 소유하던 면적대비 떼어간 토지의 면적비율을 각각 각필 감보율이라 하고, 사업시행 전 총면적과 구획정리 후 총면적의 비율을 평균감보율이라 한다. 사업시행자가 이렇게 토지를 떼어가 소유자의 면적이 줄어도 소유자는 종전보다 토지가치가 늘어나기 때문에 불만이 적다."
417,정원수는 실용이나 관상을 목적으로 식재되는데 그대로 방치해두면 가지가 쓸데없이 길게 자라거나(도장) 밀생하여 고사지(枯死枝)가 생긴다. 또 병해충의 피해를 입어 수세가 약해지거나 수형이 납작해져 본래의 식재목적인 관상과 실용적 가치가 떨어진다. 이러한 것을 예방하고 정원수의 건전한 발육과 아름다운 수형을 유지하기 위하여 인위적 조작이 필요하게 되는데 이러한 작업이 정지(整枝)·전정(剪定) 작업이다. 정지작업은 수목을 식재목적에 맞도록 줄기와 가지의 생장을 조정하는 방법을 말한다. 전정작업은 정지를 하기 위하여 나무의 가지나 줄기 및 잎의 일부를 잘라내는 작업을 말한다.
418,"제3자가 채무자의 채무를 보증해 주기 위하여 담보물을 제공한 사람을 물상보증인 이라 한다. 예컨대 A은행에 빚이 있는 자신의 동생 B의 채무를 담보하기 위해 C가 자신의 부동산에 저당권을 설정하여 담보물을 제공하는 예이다. 물상보증인도 채권자와 계약으로 저당권 또는 질권을 설정한다. 일반보증인과 달리 물상보증인의 책임은 자신이 담보로 제공한 것에 한한다. 즉, 동생 B의 채무가 3억이고, C가 제공한 담보물의 가액은 1억 원이라 할 경우, 남은 2억 원에 대한 부족분은 채무자인 동생 B의 책임이다. 또한 물상보증인이 그 채무를 변제하거나 질권의 실행으로 인하여 질물의 소유권을 잃은 경우 보증채무에 관한 규정에 의하여 채무자에 대한 구상권을 취득하게 된다. 근거법은 민법이다."
419,"혁신도시를 조성하기 위하여 시행하는 사업을 말한다. 국토해양부장관은 국가기관 및 지방자치단체, 대통령령이 정하는 정부투자기관, 지방공기업중에서 혁신도시개발사업의 시행자를 지정한다. 사업시행자는 혁신도시개발사업을 효율적으로 시행하기 위하여 필요한 경우 부지조성공사 등 혁신도시개발사업의 일부를 주택법의 규정에 따른 등록업자 또는 건설산업기본법의 규정에 따른 등록업자로 하여금 대행하게 할 수 있다. 사업시행자가 혁신도시개발사업을 시행하려는 경우에는 혁신도시개발계획을 작성하여 국토해양부장관의 승인을 얻어야 한다. 승인된 개발계획을 변경하려는 경우에도 또한 같다. 사업시행자가 개발계획을 작성하는 경우 지역중소업체가 개발사업에 활발하게 참여할 수 있도록 배려해야 한다.개발계획에는 다음의 사항이 포함되어야 한다. ① 개발계획의 명칭, 혁신도시개발예정지구의 위치 및 면적, ② 사업시행자의 명칭 및 주소와 대표자의 성명, ③ 혁신도시개발사업의 시행기간, ④ 인구수용·토지이용·교통처리 및 환경보전에 관한 계획, ⑤ 재원조달계획 및 연차별 투자계획, ⑥ 교육·문화·체육·보건의료·복지 및 가족친화 시설의 설치계획, ⑦ 혁신도시개발예정지구 밖의 지역에 기반시설을 설치하여야 하는 경우에는 그 시설의 설치에 필요한 비용의 부담계획, ⑧ 도로, 상·하수도 등 주요 기반시설의 설치계획(비용부담계획을 포함), ⑨ 그 밖에 대통령령이 정하는 사항, 국토해양부장관은 개발계획을 승인하려는 경우 관할 시·도지사 및 시장·군수 또는 구청장의 의견을 들은 후 관계 중앙행정기관의 장과의 협의와 혁신도시위원회의 심의를 거쳐야 한다. 국토해양부장관은 개발계획을 승인한 때에는 이를 관보에 고시하고, 관할 특별자치도지사, 시장·군수 또는 구청장에게 그 내역을 송부하여 주민이 열람할 수 있게 해야 한다. 개발계획이 승인·고시된 때에는 도시기본계획의 수립 또는 변경과 그에 관한 국토해양부장관의 승인이 있는 것으로 본다. 근거법은 공공기관 지방이전에 따른 혁신도시 건설 및 지원에 관한 특별법이다."
420,"공익사업 고시 지구 내에서 매수나 수용 또는 철거되는 부동산 등을 소유하는 자로서 ① 사업인정고시일 1년 전부터 해당 토지의 소재지와 동일한 시(행정시를 포함함)·구(자치구를 말함) 또는 읍·면(도농복합형태인 시의 읍·면을 포함함), 또는 이러한 지역과 연접한 시·구 또는 읍·면지역에 계속하여 주민등록을 하지 아니한 자 ② ①의 지역에 주민등록을 하였으나 당해 지역에 사실상 거주하지 않는 자를 부재부동산소유자라 한다. 단 질병으로 인한 요양, 징집으로 인한 입영, 공무, 취학 그 밖에 이에 준하는 부득이한 사유로 인하여 거주하지 않은 경우에는 그렇지 않다. 부재부동산소유자가 보상받을 때 1억 원을 초과하면 초과부분은 사업시행자가 발행하는 채권으로 지급받아야 한다. 관련법은 공익사업을 위한 토지 등의 취득 및 보상에 관한 법률이다."
421,"주택법에는 공동주택 중 주택으로 쓰이는 층수가 5개 층 이상인 주택을 아파트라 하여 다른 공동주택과 구별한다. 아파트 층수를 산정할 때 1층 전부를 필로티 구조로 하여 주차장으로 사용하면 필로티 부분을 층수에서 제외한다. 아파트는 국민주택기금의 지원 여부 및 주거의 용도로만 쓰이는 면적 등에 따라 민영아파트, 국민아파트, 임대아파트로 구분한다.아파트라는 말은 아파트먼트 하우스 (apartment house)의 준말로 일본 사람이 쓰는 말을 비판 없이 그대로 차용하여 쓰는 말이다. 영국에서는 플랫(flat)이라 부른다. 한 동의 건물에 여러 세대가 살 수 있도록 건축한 집합주택을 말하며, 공동주택이라고도 한다. 한 건물 안에 입구, 계단 또는 복도를 공용하고 보통 하나하나 주거를 아파트먼트라 하고, 그 한 동의 건물을 아파트먼트 하우스라 한다. 20세기 들어서서 도시화가 진행된 국가에서 주거형태의 하나로 자리 잡았다. 경제적으로는 대지와 건축공사비를 절감하여 생산할 수 있고, 도로 기타 공공시설을 절약할 수 있으며, 단독주택에 비하여 생산가격이 저렴한 장점이 있고 관리비도 저렴하다. 한편 단지로 개발하기 때문에 건축설계나 시공에 변화를 주어 좋은 시설과 좋은 환경을 창출할 수 있으며, 슈퍼마켓, 우체국, 주차장, 초등학교 등 편익시설이나 공공시설 근접하여 생활이 편리하다. 반면에 고층이나 초고층은 화재 등의 재해에 대피가 어려운 불안전한 단점도 있으며, 어린이의 사회성이 떨어지는 단점도 있다. 공동생활에서 오는 소음, 진동 등 여러 가지 불편함도 있으며 장독대, 김장독을 놓을 곳이 없는 생활상의 불편함도 있다. 최근에는 이것이 진화하여 호텔처럼 관리하는 시스템을 갖춘 아파트호텔로 진화하였다. 이것은 국토가 좁은 한국에서 과거의 단독주택 대신 주된 주거형태로 자리 잡았으며, 산업화로 도시에 주택이 부족할 때 대량 생산하여 공급함으로써 주택문제를 해결하는데 크게 기여한 주거형태로 평가받고 있다. 관련법은 주택법이다."
422,"주택단지의 입주자 등의 생활복리를 위한 공동시설을 말한다. 어린이놀이터, 근린생활시설, 유치원, 주민운동시설 및 경로당, 그 밖에 입주자 등의 생활복리를 위하여 주민운동시설, 주민교육시설(영리를 목적으로 하지 않고 공동주택의 거주자를 위한 교육장소로 이용되는 시설), 청소년수련시설, 주민휴게시설, 도서실(도서관법에 따른 작은 도서관과 정보통신망을 갖추고 인터넷 등을 할 수 있는 정보문화시설을 포함), 독서실, 입주자집회소, 경로당, 보육시설, 보금자리주택의 단지 내에 설치하는 사회복지지설, 원룸형 주택에 설치하는 공용취사장, 공용세탁실, 그 밖에 거주자의 취미활동이나 가정의례 또는 주민봉사활동 등에 사용할 수 있는 시설 등이 복리시설에 속한다. 근거법은 주택법 및 주택건설기준 등에 관한 규정이다."
423,"민법상 채무이행을 보증하기 위하여 채무자가 채권자에게 주는 금전으로 부금, 거치금 등과 같은 일시금을 말한다. 부동산임대차에서 임차인이 임대인에게 수여하는 일시금을 보증금이라 하나 제주도처럼 보증금관행이 없는 곳도 있다. 이것은 임대료 체납 등 계약불이행에 임대료를 담보하는 것으로 손해배상의 성질을 띤 것이 있고, 또 임대 빌딩 등에서 임대차계약기간 만료 전에 중도해지를 요구할 경우 1년 이내 해지 요구 시는 50%, 2년 이내 해지시는 30%하는 식으로 공제하고 나머지를 임차인에게 반환하는 등의 위약금적 성격을 띤 것이 있다. 이 보증금은 전세금이나 권리금과 다르다."
424,"부동산을 상품으로 취급하는 총체적인 업을 말한다. 부동산업은 크게 부동산공급업, 부동산임대업, 부동산서비스업으로 나눌 수 있다. 부동산공급업은 다시 택지개발업(일반택지조성분양, 특수택지조성분양), 건물분양업(주거용건물분양, 비주거용건물분양), 복합부동산업(레저용시설 및 부지, 콘도미니엄 및 부지, 별장·골프장·관광농원), 도시개발업(신도시개발업, 도시재개발업)으로 분류된다. 부동산임대업은 토지, 건물, 복합부동산임대업으로 분류되며, 부동산서비스업은 부동산중개, 감정평가, 관리, 상담, 권리분석 및 보증, 금융업으로 분류된다."
425,"인접한 토지의 소유자가 서로 어느 정도자기 토지의 이용에 관한 내용을 제한하여 상대방의 토지 이용을 원활하도록 하는 관계를 말한다. 민법 제216조에서 제244조에 이르기까지 상린관계에 대해 규정하고 있다. 토지의 경계나 그 근방에서 담 또는 건물을 축조하거나 수선하기 위하여 필요한 범위 내에서 이웃토지의 사용을 청구하는 것, 매연 등으로 인해 상대방에게 피해를 주지 않을 것, 타인의 토지를 통과하여 필요한 수도, 배수관, 전선 등의 시설하는 것, 주위토지의 통행권, 자연유수 승수의무와 권리, 소통공사권 등이 있다."
426,"공인중개사의 업무 및 부동산 거래신고에 관한 법률상 중개대상물의 범위는 토지, 건축물 그 밖의 토지정착물과 그밖에 대통령령이 정하는 재산권 및 물권을 한정 하고 있다. 이 법에서 대통령령이 정하는 중개 대상물은 입목에 관한 법률상 입목으로 토지에 부착된 수목의 집단으로서 그 소유자가 이법에 따라 소유권 보전의 등기를 받은 입목, 공장저당법상 공장에 속하는 일정한 기업용 재산으로써 구성되는 일단의 기업재산으로서 공장저당법에 의해 소유권과 저당권의 목적이 되는 공장재단 그리고 광업재단저당법상 광업재단 이다."
427,"우리나라의 용도지역지구제의 서양말이다. 용도규제, 혹은 지역지구제라 부른다. 도시를 조례에 따라 몇 개의 지역(zone)으로 분할하고 그 경계를 나누는 것이며, 각 지역별로 상업, 공업, 주택 등 토지이용을 정하는 일이며, 건물의 위치, 면적, 높이, 형태, 용도 그리고 건폐율을 정하는 일이다."
428,"부동산의 가격변화율에 대한 공급량의 변화율을 측정하는 척도로, 공급량의 변화율을 가격의 변화율로 나눈 것이다. 탄력성의 값이 1보다 적을 경우 비탄력적이라 하고 1보다 클 때는 탄력적이라 한다. 탄력치는 다음 식으로 구한다. ‘수요의 탄력성’도 마찬가지 사고방식으로 구한다.예) 토지가 평당 1,000만 원일 때 공급량이 2000평이었는데, 2000만 원으로 상승하니 공급량이 3,000평이 되었다고 하면 계산은 다음과 같다."
429,"미등기전매는 금지된다. ① 소유권이전등기 신청의무기간 개시 이전의 계약체결을 한 경우에는 부동산의 소유권을 이전받을 것을 내용으로 하는 계약을 체결한 자가 위의 소유권이전등기 신청의무기간 개시일 이후 그 부동산에 대하여 다시 제3자와 소유권 이전을 내용으로 하는 계약이나 제3자에게 계약 당사자의 지위를 이전하는 계약을 체결하고자 할 때에는 그 제3자와 계약을 체결하기 전에 먼저 체결된 계약에 따라 소유권이전등기를 신청하여야 한다. 또 ② 소유권이전등기 신청의무기간 개시 이후의 계약체결을 한 경우에는 부동산의 소유권을 이전받을 것을 내용으로 하는 계약을 체결한 자가 소유권이전등기 신청의무기간 개시일에 그 부동산에 대하여 다시 제3자와 소유권이전을 내용으로 하는 계약을 체결한 때에는 먼저 체결된 계약의 반대급부의 이행이 완료되거나 계약의 효력이 발생한 날부터 60일 이내에 먼저 체결된 계약에 따라 소유권이전등기를 신청하여야 한다. 만약 조세부과를 면하려는 목적, 다른 시점간의 가격변동에 따른 이득을 얻으려는 목적, 소유권 등 권리변동을 규제하는 법령의 제한을 회피할 목적으로 중간생략등기를 하여 법을 어길 경우 3년 이하의 징역이나 1억 원 이하의 벌금이 부과된다."
430,"매도인이 동일한 목적물을 2인 이상의 매수인에게 2중으로 매매하는 것이다. 예를 들면 매도인 갑이 어떤 건물을 을에게 매도하고 이전등기가 완료되기 전에 병에게 매매한 경우를 말하는 것으로, 이런 경우에는 을과 병중 먼저 이전등기를 완료하는 자가 소유권을 취득하고 이전등기를 하지 못한 사람은 갑에게 손해배상을 청구할 수 있다."
431,"등기부상의 권리를 취득하거나 또는 그 권리가 증대되는 자를 말한다. 즉 등기를 하면서 등기상의 이득을 얻는 자를 말하는데 예를 들면 부동산의 매수인, 저당권자가 있다."
432,"

직접환원법
부동산용어사전

감정평가 할 때 수익방식을 적용하면서 순수익을 구하는 하나의 방법이다. 순수익을 자본환원 하여 수익가격을 구하는 방법 중 하나로 대상 부동산의 1기간 순수익을 구하여, 이 순수익에 대응하는 환원이율로 당해 순수익을 환원하여 대상 부동산의 가격을 구하는 방법이다. 기간은 유기(有期)와 무기(無期)가 있다.
외국어 표기 直接還元法(한자)

"
433,"이것은 국민주택 등을 분양받기 위하여 가입하는 저축이며, 가입자격은 무주택세대주이고 납입기간은 청약저축에 가입한 날부터 국민주택 등(분양전환 되지 않는 임대주택 제외)의 입주자로 선정된 날까지이다. 월납입금은 2만 원 이상 10만 원 이하(납입금액의 단위는 5천원임)다. 청약저축을 해지할 때에는 원금 및 이자가 일시에 지급된다."
434,"공용부분이란 건축물의 전유부분을 제외한 복도·계단·입구의 홀 등은 공용부분 공간으로 여러 사람이 이용하는 공간을 말한다. 즉 전용부분 외의 건물부분, 전용부분에 속하지 않는 건물의 부속물 및 규약으로 정한 공용부분이다(집합건물의 소유 및 관리에 관한 법률 제2조). 집합건물에서 건물의 안전이나 외관을 유지하기 위해 필요한 지주, 지붕, 외벽, 기초공작물 등은 구조상 구분소유자의 전원 또는 일부의 공용에 제공되는 부분으로 구분소유의 목적이 되지 않으며, 건물의 골격을 유지하는 외벽이 구분소유권자의 전원 또는 일부의 공용에 제공되는지 여부는 그것이 1동 건물 전체의 안전이나 외관을 유지하기 위해 필요한 부분인지 여부로 결정된다(대법원, 92다32272판결). 따라서 건물의 어느 부분이 구분소유권자 전원 또는 일부의 공용에 제공되는지 여부는 소유자들 간에 특단의 합의가 없는 한 그 건물의 구조에 따른 객관적 용도에 따라 결정된다(대법원, 89다카1497 판결, 대법원, 2004다30279 판결). 그리고 어느 부분이 전유부분인지 공용부분인지 여부를 판단하는 기준시점은 구분소유가 성립한 시점이다. 즉 원칙으로 건물 전체가 완성되어 건축물대장에 집합 건물로 등록된 시점이며, 그 후의 건물개조나 이용 상황의 변화 등은 전유부분인지 공유부분인지 여부에 영향을 미칠 수 없다(대법원, 2004다30279 판결).공용부분을 변경하기 위해서는 구분소유자 및 의결권의 각 4분의 3 이상의 다수에 의한 집회결의로써 의결해야 한다(집합건물법 제15조). 이 공용부분은 건물부분, 복리시설, 부대시설로 나누어 보면 아래와 같다.1) 건물부분 : 주동부분(柱棟部分)의 공용부분은 공동주택의 건물 중 전용부분 이외의 것으로 ｢집합건물의 소유 및 관리에 관한 법률｣ 제3조(공용부분)에 합당한 조건을 갖춘 ① 주요 구조부로서 벽, 기둥, 바닥, 보, 지붕, 주 계단 있고, ② 기타 전용부분에 속하지 않는 현관홀·승강기실·옥상·기초·외벽·기계실·전기실·지하차고 등이 있다. 이러한 부분을 ‘법률상 당연 공용부분’이라 한다. ①에 해당하는 외벽의 바깥쪽 면은 외벽과 일체를 이루는 공용부분이다(대법원, 92다32272 판결, 대법원, 94다50380 판결).2) 복리시설 등 : 공용부분의 ① 부속건물은 관리사무소·경비실 등이 있고, ② 복리시설로 어린이 놀이터, 주민운동시설, 경로당, 유치원 및 보육시설, 주민공동시설, 문고 등이 있고, ③ 기타 거주자의 취미활동, 종교활동, 주민봉사활동에 사용할 수 있는 시설 등이 있다.3) 부대시설 : 건물과 건물부속의 공용시설이 있다. 이들은 ‘성질과 구조상 공용부분’이라 한다. ① 전기, 전화, 가스, 급수, 배수(配水), 배수(排水), 환기, 난방, 소화, 배연 및 오물처리설비와 굴뚝, 승강기, 피뢰침, 국기게양대, 텔레비전 공동시청안테나 및 종합유선방송의 구내전용선로실비, 우편물수취함, ② 보안등, 대문, 경비실, 자전거보관소, 조경시설, 옹벽, 축대, 단지 안 도로, 안내표지판, 게시판, 쓰레기통, 공중전화, 공중화장실, 저수시설, 지하양수시설, 대피시설, 쓰레기 수거 및 처리시설, 오수정화시설, 정화조, 소방시설, 냉난방공급시설, 급탕공급시설, 공동저탄장, 수해방지시설, ③ 주차장, 관리사무소, 담장, 입주자집회소."
435,집합투자기구에 출자한 지분(투자신탁의 경우에는 수익권을 말함)이 표시된 증권을 말한다. 집합투자증권을 사모로만 발행하는 집합투자기구로 투자자수 총수가 49명 이하인 것을 사모집합투자기구라 한다. 근거법은 자본시장과 금융투자업에 관한 법률이다.
436,"주택가격지수란 국민은행에서 전국의 주택 매매 및 전세가격을 조사하여 일정시점(2008.12=100)을 기준 시점으로 한 라스파이레스산식을 적용하여 지역별, 주택유형별, 주택재고 구성비를 가중치 값으로 부여하여 산출하는 지표를 말한다. 전국의 아파트, 단독, 연립주택 중 층화 2단 집락 확률비례추출법으로 표본을 설계하고 매주 또는 매월 조사기준일의 표본주택이 거래가 된 경우에는 실거래가격을 거래가 되지 않은 경우에는 거래사례비교법으로 조사한 가격을 해당지역 부동산중개업소에서 직접 온라인상 조사표에 입력하는 방식으로 조사한다. 이 주택통계는 개별 아파트의 영향력을 동일하게 반영하기 위하여 변동률의 평균값을 채용하기 때문에 전체 주택시장의 동향(trend)을 파악하는데 유효하다. 한편 타조사기관의 주택통계는 가격평균의 변동률 또는 시가총액의 변동률을 계산하는 경우가 있고, 실제 신고한 거래가격의 변동률을 측정하는 통계가 있는데, 이들 통계와 성격과 목적이 다른 통계다. 1986년 당시 주택은행이 작성하기 시작하여 국민은행으로 합병된 후에도 지속되고 있으며, 국내 유일의 주택통계 장기시계열 지수라 할 수 있다. 미국에는 스탠더드 앤드 푸어 케이스 실러 주택가격지수(Standard & Poor’s - Case Shiller Housing Price Index) 등이 있다."
437,"공장에 속하는 일정한 기업용 재산으로 구성되는 일단의 기업재산으로서 공장저당법에 의한 소유권과 저당권의 목적이 되는 것을 말한다. 공장재단은 다음에 열거하는 것의 전부 또는 일부로 구성될 수 있다. ① 공장에 속하는 토지, 건물, 그 밖의 공작물, ② 기계, 기구, 전봇대, 전선, 배관, 레일, 그 밖의 부속물, ③ 항공기, 선박, 자동차 등 등기나 등록이 가능한 동산, ④ 지상권 및 전세권, ⑤ 임대인이 동의한 경우에는 물건의 임차권, ⑥ 지적재산권. 다만 타인의 권리의 목적인 물건이나 압류, 가압류 또는 가처분의 목적인 물건은 공장재단의 구성물이 될 수 없다. 공장재단은 공장재단등기부에 소유권보존등기를 함으로써 설정되며 공장재단은 1개의 부동산으로 본다. 공장재단은 소유권과 저당권 외의 권리의 목적이 될 수 없으나 저당권자가 동의한 경우에는 임대차의 목적물로 할 수 있다. 공장재단의 구성물은 공장재단과 분리하여 양도하거나 소유권 외의 권리, 압류, 가압류 또는 가처분의 목적으로 하지 못한다. 다만, 저당권자가 동의한 경우에는 임대차의 목적물로 할 수 있다. 공장재단은 공장재단에 설정된 저당권이 소멸한 후 10개월 내에 새로운 저당권을 설정하지 않거나 소멸등기를 한 경우 소멸된다. 근거법은 공장 및 광업재단 저당법이다."
