,0
840,"측량·수로조사 및 지적에 관한 법률상 지목의 종류중 하나로 학교 교사와 이에 접속된 체육장 등 부속시설물의 부지를 말한다. 학교용지 확보 등에 관한 특례법에 의해 300가구 규모 이상의 개발사업을 진행하기 위해서는 국토의 계획 및 이용에 관한 법률에 명시된 학교시설의 설치기준을 따라야하며, 사업 시행자는 학교 용지를 개발하거나 학교 용지를 확보할 때 교육감의 의견을 들어야 한다. 또한 광역단체의 교육감은 학교 시설의 설치 기준에 못 미치는 개발 사업에 대해서는 개발사업시행자에게 그 개발사업의 규모와 지역여건을 교려하여 적절한 규모의 학교용지를 확보 하도록 할 수 있다."
841,"동일한 직장에 근무하는 무주택 근로자가 주택을 마련하기 위하여 설립한 조합을 말한다. 직장주택조합의 설립을 위해서는 해당주택건설대지의 80/100 이상의 토지에 대한 토지사용승낙서, 창립총회의 회의록, 조합장선출동의서, 조합원 명부, 사업계획서 등을 첨부하여 주택조합의 주택건설대지를 관할하는 시장·군수·구청장에게 제출해야한다. 조합의 변경을 위해서는 변경의 내용을 증명하는 서류, 해산을 위해서는 조합원의 동의를 얻은 서류를 제출해야 한다. 직장인주택조합원의 자격은 지역주택조합의 조합원에 해당하는 자여야 하며, 조합설립인가신청일 현재 동일한 시·군에 지역에 6개월 이상 거주한 자여야 한다. 직장주택조합의 구성원을 위해 건설한 주택은 사업주체가 국민주택을 해당 조합원에게 우선 분양할 수 있다. 국민주택 등을 단체 분양 받으려는 직장주택조합의 조합원은 청약저축에 가입하여 매월 약정납입일에 월 납입금을 6회 이상 납입한 사람이어야 하며, 단체분양신청자가 많아 경쟁이 있을 때는 해당주택 건설지의 거리에 따라 순위를 정하고 같은 순위에 경쟁이 있을 때는 신청조합원의 평균저축총액이 많은 조합에 단체 분양된다."
842,"동일한 토지소유자에 속하는 하나의 토지 중 공익사업에 편입되고 남은 일부의 토지를 잔여지라 한다. 잔여지가 종전의 목적을 사용할 수 없게 되거나 그 가치가 현저하게 떨어진 경우, 사업인정 이후에는 관할 토지수용위원회에 매수(수용)를 청구할 수 있다. 이 경우 수용의 청구는 매수에 관한 협의가 성립되지 아니한 경우에 한하되, 그 사업의 공사완료일까지 하여야 한다."
843,"농어촌정비법에 정해 놓은 농어촌 관광휴양사업은 다음과 같은 것이 있다.①농어촌 관광휴양단지사업: 농어촌의 쾌적한 자연환경과 농어촌 특산물 등을 활용하여 전시관, 학습관, 지역 특산물 판매시설, 체육시설, 청소년 수련시설, 휴양시설 등을 갖추고 이용하게 하거나 휴양 콘도미니엄 등 숙박시설과 음식 등을 제공하는 사업②관광농원사업: 농어촌의 자연자원과 농림수산 생산기반을 이용하여 지역특산물 판매시설, 영농 체험시설, 체육시설, 휴양시설, 숙박시설, 음식 또는 용역을 제공하거나 그 밖에 이에 딸린 시설을 갖추어 이용하게 하는 사업③주말농원사업: 주말영농과 체험영농을 하려는 이용객에게 농지를 임대하거나 용역을 제공하고 그 밖에 이에 딸린 시설을 갖추어 이용하게 하는 사업④농어촌민박사업: 농어촌지역과 준농어촌지역의 주민이 거주하고 있는 단독주택(단독주택과 다가구주택)을 이용하여 농어촌 소득을 늘릴 목적으로 숙박·취사시설 등을 제공하는 사업"
844,"델파이라는 말은 고대 그리스 신화 중 아폴로 신이 미래를 통찰하고 신탁하였다는 델파이 신전에서 따온 것이며, 이 기법은 아폴로 같이 미래를 예측하는 기법으로 해당 전문가들의 직관으로 미래를 예측하여 결정하는 방법이다. 기법에는 수량델파이, 정책델파이, 사술델파이(historic Delphi)가 있다. 수량델파이는 수량예측을 최소한의 범위까지 구체화하는 것이 목적이다. 예로 2020년의 주택수요량을 예측하는 것이다. 정책델파이는 정책내용과 우선순위를 결정하는 기법으로, 100만호 임대주택건설을 우선하는 것을 들 수 있다. 사술델파이는 역사적 인물을 연구하여 그들의 조언을 상정하여 해당분야 정책결정자에게 도움을 주는 기법이다. 조직의 구성원들이 대면하여 만나지 않는 점만 제외하면, 명목 집단기법과 유사한데 많은 시간을 소비하는 기법이어서 신속한 의사결정을 하는 일에는 이용하기 어렵다."
845,"물권의 발생·소멸을 통틀어 일컫는 말이다. 물권의 주체 입장에서 말한다면 물권의 득실변경이라 표현한다. 오늘날의 물권변동은 대부분 물권의 득실변경을 목적으로 하는 법률행위의 효과로 일어나는데 이러한 물권변동을 목적으로 하는 의사표시를 요소로 하는 법률행위를 물권행위 또는 물권적 법률행위라고 한다. 물권의 변동은 법률행위에 따라 생기는 경우와 그밖에 소멸시효, 취득시효, 상속, 무주물선점, 유실물습득, 매장물 발견, 첨부, 민법외의 규정에 의한 공용징수, 몰수, 경매 등에 따라 생기며, 일정한 판결을 받아 생기는 경우도 있다. 근거법은 민법이다."
846,"행정법상 의무위반에 대하여 그 제재로서 형벌에 형명(刑名)이 정해져 있는 형벌로 사형, 징역, 금고, 자격상실, 자격정지, 벌금, 구류, 과료, 몰수 등이 있다. 감정평가사, 공인중개사, 주택관리사 등 전문자격자는 관계법령에 따라 위법한 행위를 하면 행정형벌을 받을 수 있다."
847,적산법은 가격시점의 대상 부동산 기초가격에 기대이율을 곱해 얻은 금액에 대상물권을 계속하여 임차하는데 필요한 여러 가지 경비를 가산하여 시산임료를 구하는 데 이 방법으로 구한 시산임료를 적산임료라 한다.
848,"지대이론 중 하나로 마르크스(Karl H. Marx 1818~1883)가 주장한 이론이다. 그는 토지 사유(私有) 자체가 농산물 가격을 인상시키고 잉여가치는 평균이윤보다 높아 이것이 절대지대(絶對地代, absolute rent)의 원칙이라 주장하였다. 즉, 자본주의(capitalism)사회에서 모든 토지는 누군가가 소유하고 있어서 독점(獨占)하며, 지주는 아무리 열등지라도 경제의 대가 없이는 타인의 이용을 불허기 때문에 토지소유가 자본투자를 절대적으로 제한하며, 생산물 가격이 생산가격 이상으로 높아지므로, 결국 토지소유 자체가 농산물의 가격을 인상시키고, 잉여가치는 평균이윤보다 높아진다고 주장하였다. 리카도(1772~1823)가 지대를 토양의 힘인 비옥도(肥沃度)와 입지조건(위치의 편리성) 차이에 따른 우등지와 열등지간의 차이에서 찾은 것과 달리, 마르크스는 지대가 토지 소유에서 비롯된다고 보았다."
849,"특정계약에서 입찰에 참가하고자 하는 모든 자격자가 입찰서를 제출할 수 있고 참가 입찰자 중 가장 유리한 조건을 제시한 자를 선정하는 방법을 말한다. 건설공사에서 보통 많이 이용하는 입찰방식이다. 법원경매, 국·공유재산의 임대 및 매각이나 임대계약, 공사의 도급계약 및 관용품의 구매계약 등은 원칙적으로 공개경쟁입찰로 하도록 하고 있다. 특수한 경우여서 공개경쟁입찰이 어렵거나 필요하지 않은 정도는 보통 수의계약으로 한다."
850,"국가기관이 주체가 되는 경매로서 집행행위에 관한 법원의 처분이나 그 행위에 관한 법원의 협력사항을 관할하기 위해 집행법원을 두고, 그 소속기관인 집행관이 집행행위 및 집행절차의 이행을 실시하는 경매방식을 말한다. 민사집행법 그리고 국세징수법에 의한 경매절차가 있다. 민사집행법에서는 강제집행과 담보권 실행을 위한 경매를 규정하고 있고 국세징수법에서는 국세의 체납으로 압류한 재산을 매각하는 공매를 규정하고 있다. 법원경매는 최고가 입찰자를 낙찰자로 결정한다. 자세한 사항은 경매와 공매를 참조하길 바란다. 근거법은 민사집행법과 국세징수법이다."
851,"지방자치단체의 부담, 기부채납이나 법령에 따라 지방자치단체 소유로 된 재산을 공유재산이라 한다. 공유재산의 범위는 다음과 같다. ① 부동산과 그 종물, ② 선박, 부잔교(浮棧橋), 부선거(浮船渠) 및 항공기와 그 종물, ③ 공영사업 또는 공영시설에 사용하는 중요한 기계와 기구, ④ 지상권·지역권·전세권·광업권과 그 밖에 이에 준하는 권리, ⑤ 저작권·특허권·디자인권·상표권·실용신안권과 그 밖에 이에 준하는 권리, ⑥ 주식, 출자로 인한 권리, 사채권·지방채증권·국채증권과 그 밖에 이에 준하는 유가증권, ⑦ 부동산신탁의 수익권, ⑧ ① 및 ② 재산으로 건설 중인 재산. 공유재산은 효율적으로 이용하고 관리하기 위하여 그 용도에 따라 행정재산과 일반재산으로 구분한다. 행정재산은 공용재산, 공공용재산, 기업용재산, 보존용재산이 있으며, 일반재산은 행정재산 외의 모든 공유재산을 말한다. 근거법은 공유재산 및 물품관리법이다."
852,"여러 종류의 법원 사이에 특정한 사건에 대한 재판권을 가지고 있는 법원을 말한다. 행정소송법에는 “취소소송의 제1심 관할법원은 피고의 소재지를 관할하는 행정법원으로 한다. 다만, 중앙행정기관 또는 그 장이 피고인 경우의 관할법원은 대법원소재지의 행정법원으로 한다. 토지의 수용 기타 부동산 또는 특정의 장소에 관계되는 처분 등에 대한 취소소송은 그 부동산 또는 장소의 소재지를 관할하는 행정법원에 이를 제기할 수 있다.”고 규정하고 있다. 민사소송법에서는 “소(訴)는 피고의 보통재판적(普通裁判籍)이 있는 곳의 법원이 관할한다. 부동산에 관한 소를 제기하는 경우 부동산이 있는 곳의 법원에, 등기·등록의 경우에는 등기 또는 등록할 공공기관이 있는 곳의 법원, 상속(相續)에 관한 소 또는 유증(遺贈), 그 밖에 사망으로 효력이 생기는 행위의 경우 상속이 시작된 당시 피상속인의 보통재판적이 있는 곳의 법원에 제기할 수 있다.”고 규정하고 있다. 근거법은 행정소송법과 민사소송법이다."
853,"주택임대사업자로 등록하고 2호 이상 주택을 임대하는 사업을 주택임대업이라 한다. 임대사업자에게는 세제혜택 등을 주고 있다. 2008년을 기준으로 약 4만명의 사업자가 134만호 정도를 임대하고 있다. 2007년 이후 안정된 추세다. 임대사업자 추이는 1994년 105명(32,935호)에서 2005년 37,114명(1,014,362호), 2009년 40,872명(1,311,369호)로 매년 증가하였다."
854,"

Hinterland
매일경제

일반적으로 배후지라고 하지만 상업지의 경우는 상권 또는 시장 지역이라고 쓰인다. 고객이 통행하는 곳이 가로라면 이는 고객이 존재하는 지역이라는 뜻이다. 따라서 Hinterland의 조건이고, 이를 적확하게 분석하는 것은 곧 매상고를 예측하는 입지선정활동의 열쇠이다.
동의어 힌터랜드

"
855,"국가가 직접 공공용으로 사용하거나 국가나 정부기업이 행정재산으로 사용하기로 결정한 재산 또는 지방자치단체가 직접 공공용으로 사용하거나 사용하기로 결정한 재산과 사용을 목적으로 건설 중인 재산을 말한다. 도로, 하천, 공원, 영해(領海), 해빈(海濱), 운하, 제방, 교량, 광장 등과 이들의 부속건물 등이 이에 속한다. 국유재산법상 행정재산의 일종이다. 근거법은 국유재산법과 공유재산 및 물품관리법이다."
856,"국가 또는 지방자치단체 등의 공적기관이 공공의 이익을 위하여 재정자금을 투자하여 벌이는 사업을 말한다. 국가가 강제로 토지를 취득하여 사용할 수 있는 사업이며, 토지를 취득할 때는 협의매수를 원칙으로 하나 소유자가 협의에 응하지 않으면 강제로 수용절차를 밟아 수용한다. 법령에 정한 공익사업 내용은 다음과 같은 것이 있다. ① 국방·군사에 관한 사업, ② 관계 법률에 의하여 허가·인가·승인·지정 등을 받아 공익을 목적으로 시행하는 철도·도로·공항·항만·주차장·공영차고지·화물터미널·삭도·궤도·하천·제방·댐·운하·수도·하수도·하수종말처리·폐수처리·사방·방풍·방화·방조(防潮)·방수·저수지·용배수로·석유비축 및 송유·폐기물처리·전기·전기통신·방송·가스 및 기상관측에 관한 사업, ③ 국가 또는 지방자치단체가 설치하는 청사·공장·연구소·시험소·보건 또는 문화시설·공원·수목원·광장·운동장·시장·묘지·화장장·도축장 그 밖의 공공용 시설에 관한 사업, ④ 관계법률에 의하여 허가·인가·승인·지정 등을 받아 공익을 목적으로 시행하는 학교·도서관·박물관 및 미술관의 건립에 관한 사업, ⑤ 국가·지방자치단체·정부투자기관·지방공기업 또는 국가나 지방자치단체가 지정한 자가 임대나 양도의 목적으로 시행하는 주택의 건설 또는 택지의 조성에 관한 사업, ⑥ ① 내지 ⑤의 사업을 시행하기 위하여 필요한 통로·교량·전선로·재료적치장 그 밖의 부속시설에 관한 사업, ⑦ ①부터 ⑤까지의 사업을 시행하기 위하여 필요한 주택, 공장 등의 이주단지 조성에 관한 사업, ⑧ 그 밖에 다른 법률에 의하여 토지 등을 수용 또는 사용할 수 있는 사업이다. 관련법은 공익사업을 위한 토지 등의 취득 및 보상에 관한 법률이다."
857,저당이체증권(MPTS: mortgage pass-through security)을 담보로 발행되는 채권으로 발행기관은 저당권을 보유하고 원리금 수취권은 투자자에게 이전시키는 증권을 말한다. 즉 주택저당담보부채권(MBB: mortgage backed bond)과 저당이체증권(MPTS: mortgage pass-through security)이 혼합된 형태이다.
858,"건물 임대차 기간이 만료하면 그 기간을 연장하는 것을 말한다. 주택임대차보호법에는 임대인이 임대차기간이 끝나기 6개월 전부터 1개월 전까지 임차인에게 별도로 임차를 그만 하겠다(갱신거절)고 통지하거나 계약조건을 변경하지 않으면 갱신하지 않겠다는 통지를 하지 않으면, 임대기간이 끝났어도 이미 한 임대차와 동일한 조건으로 다시 임대차한 것으로 본다고 규정해 놓았다. 임차인이 임대인에게 임대차기간이 끝나기 1개월 전까지 통지하지 않는 경우도 마찬가지다. 이렇게 미리 임대를 그만 두겠다던가 임차를 그만 하겠다던가 하는 의사를 표시하지 않고 가만히 있는 것을 묵시적 갱신이라고 말한다. 이때 임대차의 존속기간은 2년으로 본다. 하지만 임차인은 임대인에게 언제든지 계약해지를 통지할 수 있으며, 이 해지는 임대인이 통지를 받은 날부터 3개월이 지나야 그 효력이 생긴다. 임대차기간이 끝나기 전에 계약으로 기간을 연장하는 것을 명시적 갱신이라 한다. 근거법은 민법, 주택임대차보호법이다."
859,"

특별징수의무자
부동산용어사전

조세의 징수에서 직접 납세자로 하여금 납부시키는 것이 아니고, 그 징수의 편의가 있는 자로 하여금 납세자로부터 징수하여 세금을 납입하게 하는 제도를 특별징수라 하고, 이러한 의무가 있는 자를 특별징수의무자라 한다. 특별징수는 보통징수 및 신고납세에 상대되는 개념인데, 소득세, 법인세 등을 원천징수하는 자의 징수가 그 예이다.
외국어 표기 特別徵收義務者(한자)

"
860,"측량·수로조사 및 지적에 관한 법률의 지목 중 하나로, ① 제조업을 하고 있는 공장시설물의 부지, ② 산업집적활성화 및 공장설립에 관한 법률 등 관계 법령에 따른 공장부지 조성공사가 준공된 토지, ① 또는 ②의 토지와 같은 구역에 있는 의료시설 등 부속시설물의 부지를 말한다. 근거법은 측량·수로조사 및 지적에 관한 법률이다."
861,"국토의 계획 및 이용에 관한 법률상용도 지구 중 개발진흥지구 중 하나로 주거기능, 공업기능, 유통·물류기능 및 관광·휴양기능외의 기능을 중심으로 특정한 목적을 위하여 개발·정비할 필요가 있는 지구를 말한다. 개발진흥지구 안에서는 지구단위계획 또는 관계 법률에 의한 개발계획에 위반하여 건축물을 건축할 수 없으며, 지구단위계획 또는 개발계획이 수립되기 전에는 개발진흥지구의 계획적 개발에 위배되지 않는 범위 안에서 도시계획조례가 정하는 건축물을 건축할 수 있다. 도시지역 외의 지역에 지정된 개발진흥 지구의 용적률은 100% 이하이고 건폐율은 40% 이하이다."
862,"부동산 활동주체가 소비자나 이용자의 욕구를 파악하고 창출하여 자신의 목적을 달성시키기 위해 시장을 정의하고 관리하는 과정을 말한다. 마케팅의 대상에 따라 주거마케팅, 업무용부동산마케팅, 토지투자마케팅으로 구성된 토지건물공급마케팅, 중개·평가·권리분석·금융·관리·상담 등의 분야가 각각 그들의 서비스를 개발·판매하기 위해 노력하는 서비스마케팅, 사무실·토지·주택·공장·점포·별장·창고 등 각종 부동산의 임대(賃貸)를 개발 또는 조장하기 위한 임대마케팅으로 나눌 수 있다."
863,"부동산개발업의 관리 및 육성에 관한 법률에 따라 하는 사업이다. 즉 이 사업은 공급목적으로 형질변경이나 건축물, 건물 등을 건설하여 판매나 임대하는 사업이다. 사업, 목적, 개발 단계별로 규율되고 있는 개발행위에 대한 규정 중에서 개발에 필요한 공통 요소를 ‘부동산개발’로 정의하여 부동산개발업의 영역을 명확히 한 것이 이 사업이다. 따라서 개발행위란 건축물의 건축, 공작물의 설치, 토지의 형질변경, 토석의 채취, 토지분할, 물건을 쌓아 놓은 행위로 규정했다. 그리고 부동산 개발은 시공하는 행위를 제외하여 부동산개발사업을 건설업과 구분하였다."
864,"국토교통부장관이 중개업자 상호간에 부동산매매 등에 관한 정보의 공개와 유통을 촉진하고 공정한 부동산거래질서를 확립하기 위하여 지정한 부동산 유통기구를 말한다. 이 지정을 받아 부동산 거래정보를 제공하여 유통을 지원하는 자를 거래정보사업자라 한다. 한국감정원과 한국공인중개사협회가 지정받아 운영 중이다. 거래정보사업자는 중개업자로부터 공개를 의뢰받은 중개대상물의 정보에 한하여 이를 부동산거래정보망에 공개하여야 하며, 의뢰받은 내용과 다르게 정보를 공개하거나 어떠한 방법으로든지 중개업자에 따라 정보가 차별적으로 공개되도록 하여서는 안 된다. 이 유통기구는 미국의 MLS나 일본의 REINS와 같은 것으로 중개업자들이 물건정보를 유통기구에 등록하고 공동으로 중개하는 시스템이다. 미국이나 일본이 안정되게 운영되는 것에 비하여 우리나라 유통기구는 아직 정상궤도에 진입하지 못하고 있다. 중개업자들은 이 유통기구보다는 오히려 일반 포털 등의 타 매체를 이용하여 물건을 광고하고 있으며, 특히 동업자 단체가 운영하는 유통기구를 신뢰하지 않고 있어 개선이 필요하다."
865,"압력탱크를 설치하고 에어컴프레서로 공기를 공급해 그 압력으로 급수하는 방식이다. 탱크는 어디든 설치할 수 있고, 고가시설이 불필요하므로 외관이 깨끗한 장점이 있다. 반면 압력차가 생기면 수압이 일정치 않고, 탱크 제작비가 많이 들며, 수시로 공기를 주입해야 하고, 취급이 어려운 단점이 있다."
866,"토지의 소유자 등이 그 이용을 장기간 방치하거나 적극적인 사용을 하지 않는 토지를 말한다. 산림자원의 조성 및 관리에 관한 법률에는 농어촌정비법의 한계농지, 2년 이상 해당 토지 본래의 용도로 사용하고 있지 않는 토지, 전·답·과수원·목장용지·잡종지로서 토지소유자가 산림으로 전환하려는 토지를 유휴토지로 정의해 놓았다. 유휴토지를 산림으로 전환하는 자에게는 등기 또는 이에 관련된 수수료 등의 비용, 산림경영계획의 작성·변경에 소요되는 비용, 조림 및 숲 가꾸기 비용 그 밖의 산림 경영 및 소득 증대를 위한 비용을 보조 또는 융자 받을 수 있다."
867,"매 기간 말 수령하는 일정금액을 현재가치로 환산한 금액의 합계이다. 연금의 현재가치라고도 한다.계산식은 다음과 같다.r : 이자율, n : 기간"
868,"건축법은 용도변경은 허가를 통해서 하는 것과 신고를 통해서 하는 것으로 구분하는데 그 구분을 위해 건축물을 9개의 시설군과 28개의 용도군으로 분류하고 있다. 그중 하나의 시설군으로 주차장, 세차장, 폐차장, 검사장, 매매장, 정비공장, 운전학원 및 정비학원, 차고 및 주기장을 말한다."
869,"공동주택에서 각 세대로 들어가는 형식의 하나로, 계단을 따라 집으로 들어가는 형식을 말한다. 이 형식은 계단과 승강기가 있는 홀에서 직접 각 세대로 들어갈 수 있는 형식으로써 프라이버시가 좋고 교통도 적은 면적으로 처리할 수 있는 장점이 있다. 중층은 계단실을 이용하고 고층은 승강기를 주로 이용하며 계단실은 비상용으로 이용한다. 그러나 이 형식은 승강기를 공동으로 사용하는 주호의 수가 적기 때문에 건축비용이 많아진다. 주동입구에서 계단 또는 승강기에서 주호 순으로 접근한다. 공동으로 사용하는 계단은 유효 폭 120㎝ 이상, 단 높이 18㎝ 이하, 단 너비 26㎝ 이상이어야 한다. 근거는 주택건설기준 등에 관한 규정이다."
870,"공증인은 당사자나 그 밖의 관계인의 촉탁에 따라 법률행위나 그 밖에 사권(私權)에 관한 사실에 대한 공정증서(公正證書)의 작성, 사서증서에 대한 인증, 공증인법과 그 밖의 법령에서 공증인이 취급하도록 정한 사무를 처리하는 직무를 수행할 수 있도록 법무부장관으로부터 공증인법 제11조에 따라 임명을 받은 임명공증인과 공증인법 제15조의2에 따라 공증인가를 받은 인가공증인을 말한다. 공증인이 작성하는 문서는 공증인법이나 그 밖의 법률에서 정하는 요건을 갖추지 않을 경우 공증의 효력이 없다. 또한 공증인은 정당한 이유없이 촉탁을 거절할 수 없으며, 만일 거절할 경우에는 촉탁인이나 그 대리인에게 거절의 이유를 알려야한다. 공증인에게는 촉탁인의 동의를 받은 경우를 제외하고는 직무상 알게 된 비밀을 누설할 수 없는 비밀누설 금지, 임명공증인의 경우 다른 공무를 겸하거나 상업을 경영할 수 없고, 상사회사나 영리를 목적으로 하는 사단법인의 대표자 또는 사용인이 될 수 없다는 겸직의 금지가 있다. 근거법은 공증인법이다."
871,"보도기관에 뉴스의 소재를 제공하는 활동을 말한다. 보도기관은 신문·잡지·라디오·TV·인터넷 등에서 뉴스의 형태로 분양택지·아파트·쇼핑센터 등의 제품을 기업에 플러스가 되도록 보도한다. 홍보와 광고가 다른 점은 광고가 매체기관(방송국·신문사 등)으로부터 스페이스와 시간을 구입하고 광고비(廣告費) 범위 내에서 자유로이 연출할 수 있고 몇 번이고 반복할 수 있는데 비해 홍보는 스페이스·시간을 매체기관의 자유재량판단에 맡기고, 그것은 뉴스형태로 제공되기 때문에 반복도 불가능하다. 따라서 부동산기업은 무엇보다도 뉴스가치가 있는 소재를 제공해야 한다. 뉴스의 가치란 화제성·파급성이 있어야 하고 평소부터 그러한 소재를 마련해 두는 일이 중요하다. 이러한 뉴스의 소재로는 i) 기업의 활동과 역사, ii) 조직과 인사, iii) 경영재무, iv) 상품서비스, v) 판촉과 유통, vi) 상표·슬로건·심볼, vii) 지역사회와 관련 등이 있다."
