,0
1348,"관계 중앙행정기관의 장이 동·식물의 서식지, 생태적으로 우수한 자연환경자산, 지역의 특색 있는 문화자산 등을 조화롭게 보존·복원 및 이용하여 이를 관광 자원화하고 지역경제를 활성화함으로써 생태관광을 촉진하고, 국민 모두가 생태체험·교육의 장으로 활용할 수 있도록 하는 관광의 한 형태를 말한다. 문화체육관광부장관은 에너지·자원의 사용을 최소화하고 기후변화에 대응하며 환경 훼손을 줄이는 지속가능한 관광자원의 개발을 장려하기 위해 정보제공 및 재정지원 등 필요한 조치를 강구할 수 있다. 그리고 문화체육관광부장관과 지방자치단체의 장은 관광객의 유치, 관광복지의 증진 및 관광 진흥을 위해 다음의 사업을 추진할 수 있다. ① 문화, 체육, 레저 및 산업시설 등의 관광자원화 사업, ② 해양관광의 개발사업 및 자연생태의 관광자원화사업, ③ 관광상품의 개발에 관한 사업, ④ 국민의 관광복지 증진에 관한 사업. 근거법은 저탄소 녹색성장 기본법 및 관광진흥법이다."
1349,증여를 하면서 증여세를 면탈하기 위하여 매매로 가장하여 소유권이전등기를 하는 것과 같이 허위표시 뒤에 감추어진 행위를 말한다. 납세의무자 또는 납세의무자의 재산을 점유하는 자가 체납처분의 집행을 면탈할 목적 또는 면탈하게 할 목적으로 그 재산을 은닉하였을 때는 3년 이하의 징역 또는 3천만 원 이하의 벌금에 처해진다. 임대인이 보증금을 안주려고 재산을 은닉하거나 빼돌릴 가능성이 있으면 임차인은 보증금반환청구소송을 제기하기 전에 임대인의 동산 또는 부동산에 강제집행을 보전하기 위한 가압류를 해 놓아야 한다.
1350,"자본시장의 금융혁신과 공정한 경쟁을 촉진하고 투자자를 보호하며 금융투자업을 건전하게 육성함으로써 자본시장의 공정성·신뢰성 및 효율성을 높여 국민경제의 발전에 이바지함을 목적으로 제정한 법률을 말한다. 종전의 증권거래법, 선물거래법, 간접투자자산운용업법, 신탁업법, 종합금융회사에 관한 법률, 한국증권선물거래소법 등 자본시장과 관련된 6개 법률을 통합하여 제정한 법률(법률 제8635호)로서 2007년 8월 3일 공포되어 2009년 2월 4일부터 시행되었다. 총칙, 금융투자업, 증권의 발행 및 유통, 불공정거래의 규제, 집합투자기구, 금융투자업관계기관, 한국거래소, 감독 및 처분, 보칙, 벌칙 등 총 10편 449조와 부칙으로 구성되어 있다. 부동산간접투자는 모두 이 법률의 적용을 받는다."
1351,"일반적으로 재화의 가격이 상승하면 공급은 늘고 수요는 감소하며, 가격이 하락하면 공급이 줄고 수요가 증가한다. 재화의 가격은 이러한 수요와 공급의 상호관계로 결정되며, 그 가격은 또 다시 수요와 공급에 영향을 미친다. 이를 수요와 공급의 원칙이라 한다. 부동산은 일반재화와 달리 수요는 탄력적인 반면, 공급(供給)은 비탄력적(非彈力的)이다. 그 이유는 부증성, 개별성 때문에 공급이 대체 가능한 범위 내로 한정되기 때문이다. 이와 같은 자연특성이나 인문특성 때문에 수요·공급이 영향을 받고 가격형성에도 영향을 미친다."
1352,"2필지 이상의 토지를 1필지로 합하는 것을 말한다. 합병하려는 토지의 지번부여지역과 지목 또는 소유자가 서로 다른 경우, 합병하려는 토지에 소유권·지상권·전세권·또는 임차권등기, 승역지에 대한 지역권의 등기외의 등기(단, 합병하려는 토지 전부에 대한 등기원인 및 그 연월일과 접수번호가 같은 저당권의 등기가 있는 경우를 제외한다), 합병하려는 토지의 지적도 및 임야도의 축척이 서로 다른 경우 등을 제외하고 토지 소유자가 지적소관청에 합병 신청을 할 수 있다."
1353,"메자닌은 건물 1층과 2층 사이에 있는 중간층을 뜻하는 이탈리아어로 메자닌 캐피탈이란 지분과 차입의 중간적인 성격이 있는 재원을 통칭한다. 후순위대출이나 우선주 등이 이에 해당한다. 메자닌 캐피탈은 투자자의 보호 장치로 활용하거나 다양한 투자자금을 끌어들이기 위해 사용된다. 후순위대출 등 메자닌 캐피탈을 이용할 경우 일반 순위 대출을 제공한 대주(貸主)의 입장에서는 사실상 지분과 같은 역할을 하기 때문에 프로젝트의 신뢰도가 향상되고, 투자금의 원리금 회수 가능성이 높아진다. 후순위대출의 경우 보통 위험이 높은 만큼 일반 대출보다 금리가 높아 고위험-고수익을 원하는 투자자를 끌어들이는데 활용이 가능하다. 전환사채 등 지분으로 전환할 수 있는 부채자금의 경우 투자자는 표면금리는 일반 대출보다 낮지만 장래 지분으로 전환함에 따른 자본이득을 얻을 수 있다. 지분투자자는 이자비용을 손비 처리할 수 있기 때문에 세제혜택을 겨냥하여 메자닌 캐피탈을 활용하는 경우도 있다. 이런 메자닌 캐피탈은 건설금융에 있어서 총비용과 조달된 자금 사이의 차액의 70~80%를 메워 주는 역할을 하며, 담보가 약하기 때문에 이자율이 높은 편이다. 이 메자닌 캐피탈은 개발자에게 투자자금의 조기회수 기회와 건설에 대한 리스크를 줄여주는 역할도 있다."
1354,"부동산등기부의 하나로 건물의 권리관계를 기재한 등기부를 말한다. 등기부는 여러 장인데 등기번호란(登記番號欄), 표제부(表題部)와 갑(甲)구, 을(乙)구로 나누고, 표제부에는 표시란(表示欄), 표시번호란(表示番號欄)이 있고, 각 구에는 사항란(事項欄), 순위번호란(順位番號欄)이 있다. 다만, 을구는 적을 사항을 두지 않을 수 있다. 등기번호란에는 각 건물대지의 지번(地番)을 적고, 표시란에는 건물의 표시와 그 변경에 관한 사항을 적으며 표시번호란에는 등기한 순서를 적는다. 갑구 사항란에는 소유권에 관한 사항을 적는다. 을구 사항란에는 소유권 이외의 권리 내용을 적는다. 마지막으로 순위번호란에는 사항란에 등기한 순서를 적는다. 건물등기는 1동의 건물에 1등기용지를 사용한다. 등기부는 각 지역의 등기소에서 발급 또는 열람하나 인터넷으로도 발급받거나 열람할 수 있다. 대법원 홈페이지, 각 구청이나 주민센터의 무인민원발급창구에서 이용할 수 있다."
1355,"주택융자 대출 금융기관이 갖고 있는 주택저당채권을 기초로 발행한 채권을 말한다. 위험이 발행기관에 집중되어 유동성이 떨어지며 MBB 액면가 이상의 담보가 필요하고, 시장에서 MBS보다 유통성이 떨어진다. 이 MBB는 주택금융공사가 자기신용으로 직접 발행하는 채권이고, MBS는 주택금융공사가 자기신탁을 설정하여 발행하는 수익증권이라는 점에서 차이가 있다."
1356,"

과세권자
부동산용어사전

과세주체라고도 하며 적법하게 조세의 납부의무를 명할 수 있는 권한이 있는 자를 말한다. 국세(양도소득세, 상속세, 증여세, 법인세, 부가가치세 등)의 과세주체는 국가이고, 지방세(등록세, 취득세, 재산세 등)의 과세주체는 지방자치단체인 서울특별시, 광역시, 도, 시, 군, 구이다.
외국어 표기 課稅權者(한자)

"
1357,"부동산의 소유권 같은 일종의 권리를 보증해 주는 보험으로 일종의 보증보험 성격이 있어 보통 권원보험이라 부른다. 부동산권리의 하자나 상실, 보험계약을 체결할 때 부동산에 붙어 있던 우선 권리, 위조, 사기 등의 잠재적인 하자 때문에 부동산 소유권자나 저당권자 등 피보험자가 받는 경제 손실을 보장해 주는 보험이다. 소유권자용 권원보험과 저당권자용 권원보험이 있다. 예를 들어 부동산 거래계약을 체결할 때 몰랐던 이전 소유자의 우선 권리 때문에 현 소유자가 피해를 보게 되면 이 피해 분을 보험회사가 보상해 주는 것이다. 미국에서 창안하였으며 많이 이용한다. 권원보험이 생긴 것은 권원관계의 신뢰성 부족 때문이다. 첫째로, 권원을 완전히 믿지 못하기 때문이다. 우리나라는 등기의 공신력이 없어 부동산등기부를 믿고 거래해도 소유권원인무효 소송 등에 패소하면 소유권을 잃게 되어 거래하는 자를 보호하지 못하는 제도의 흠이 있다. 둘째로, 공부관리부서와 공부가 일치하지 않아 문제가 있다. 즉 사법부가 관리하는 등기와 행정부가 관리하는 토지대장이나 건축물 대장이 2원화되어 있으면서 내용이 불일치하는 수가 있다. 셋째로, 피해를 예방하거나 손해를 배상하는 제도가 없다. 공증제도나 등기부 실질심사권, 권리분석제도 등이 없어 거래사고 전이나 후에 피해를 구제할 대책이 없다. 넷째, 부동산 저당채권을 유동화하려면 권리가 안전해야 하는데, 불안정을 담보할 제도가 없다. 저당채권 매입자를 유인하려면 권리가 안전해야 하기 때문에 보험이 필요하다. 이러한 몇 가지 이유는 이 권원보험을 만들고 유지하는 근거가 되는 것이다."
1358,"현실적으로 주거 및 생계를 같이 하는 사람의 집단을 말하며, 보통 친족을 중심으로 구성되지만 남이 포함된 경우도 있다. 주민등록법에 정해 놓은 주민등록표의 작성단위이며 보통 세대라고 부른다. ‘인구주택총조사’ 규칙에서는 1명이 단독으로 생계를 영위하거나 2명 이상이 공동으로 취사·취침 등을 하며 생계를 영위하는 생활 단위를 가구로 규정하고 있다. 이렇게 정해 놓은 가구라는 기준은 주택을 분양할 때 분양받을 자격의 하나로 정한다든지 혹은 주택정책을 수립할 때 ‘1가구 1주택’이라는 목표를 정하는 데에도 이용한다. 이러한 기준으로 필요한 주택의 총량이나 지역별 수급계획 등을 수립할 수 있다."
1359,"입주자모집공고일 현재 무주택세대주로서 일정한 입주자격을 갖춘 사람이 개발제한구역을 해제하여 조성한 토지를 분양받아 주택을 건설·공급하는 사업주체로부터 85㎡ 이하의 민영주택을 특별 분양 받을 수 있는 제도를 말한다. 특별 분양을 받을 수 있는 사람은 입주자모집공고일 현재 무주택세대주로서 ① 해당 공공사업의 시행을 위하여 철거되는 주택의 소유자, ② 택지를 공급받을 수 있는 자이나 당해 택지개발사업으로 조성된 택지를 공급받지 못한 자, ③ 당해 토지를 공급받을 수 있는 자이나 당해 도시개발사업으로 조성된 토지를 공급받지 못한 자이다. 다만, 「공익사업을 위한 토지 등의 취득 및 보상에 관한 법률」제78조의 규정에 따라 수립된 이주대책의 대상자에 포함되어 있거나 이주정착금을 지급받은 자는 제외한다. 근거는 주택공급에 관한 규칙이다."
1360,"공공이 공익목적을 위해 개인의 재산권을 침해하는 것을 말한다. 공용침해는 공용수용, 공용사용 그리고 공용제한이 있다. 국가는 이러한 침해를 정당화하기 위해 헌법에 그 근거를 마련해 놓았다. 즉 “국민의 모든 자유와 권리는 국가 안전보장, 질서유지 또는 공공복리를 위하여 필요한 경우에 한하여 법률로서 제한할 수 있으며, 제한하는 경우에도 자유와 권리의 본질적 내용을 침해할 수 없다.” 또, 같은 법에 “공공필요에 의한 재산권의 수용, 사용 또는 제한 및 그에 대한 보상은 법률로써 하되, 정당한 보상을 지급하여야 한다.”고 규정하여 침해하면 그 대가를 보상하되 정당하게 보상하여 재산권 침해가 최소한이 되도록 배려하고 있다. 시민이 공용침해를 당하는 재산권으로 대표적인 것이 토지의 공용수용이나 공용사용이다. 공익사업이나 공용시설을 설치하기 위해 국가와 공공기관은 사인 토지의 수용이나 사용을 필요로 한다. 국유지나 공유지만으로는 공익목적을 달성할 수 없기 때문이다. 관련법은 공익사업을 위한 토지 등의 취득 및 보상에 관한 법률이다."
1361,"자기자본과 차입금으로 투자했을 때 자기자본 투자로부터 얻어 들이는 수익률이 정(+)의 레버리지일 때를 지렛대 효과라 한다. 아파트를 분양받으면 은행융자금의 이자보다 집값상승이 높아 이득을 보는 경우가 많고, 또 집을 사면 투입한 자기자본에 대한 자산가치의 상승으로 이득을 보는 수가 있다. 이것이 모두 지렛대효과다.자기자본을 S, 타인자본을 B, 수익률은 r, 그 금리를 i라 하면 자기자본 수익률 rs는 다음과 같이 나타낼 수 있다."
1362,"등기부의 전부 또는 일부가 멸실되었다가 회복절차에 따라 회복시키는 등기를 말한다. 천재지변 등에 의한 멸실회복등기와 구 등기가 부적법하게 말소된 경우에 하는 말소회복등기가 있다. 6.25전쟁으로 등기부가 소실된 것도 있고, 당시 행방불명이나 사망 등으로 인하여 부동산, 소유자 및 등기 등이 일치하지 않아 회복등기가 적지 않았다. 부동산등기법에는 등기부의 전부 또는 일부가 멸실된 경우에는 대법원장이 3개월 이상의 기간을 정해서 그 기간 내에 등기 회복을 신청하는 자는 그 등기부에서 종전순위를 보유 한다는 뜻의 고시를 하도록 되어 있다. 말소된 등기의 회복을 신청할 때는 등기상 이해관계가 있는 제3자가 있으면 신청서에 그 승낙서 또는 이에 대항할 수 있는 재판의 등본을 첨부해야 한다."
1363,"국토의 계획 및 이용에 관한 법률상의 위원회로 시·도지사가 결정하는 도시관리계획의 심의 등 시·도지사의 권한에 속하는 사항과 다른 법률에서 시·도 도시계획위원회의 심의를 거치도록 한 사항의 심의, 국토해양부장관의 권한에 속하는 사항 중 중앙도시계획위원회의 심의 대상에 해당하는 사항이 시·도지사에게 위임된 경우 그 위임된 사항의 심의, 도시관리계획과 관련하여 시·도지사가 자문하는 사항에 대한 조언 등의 자문에 응하기 위해 존재하는 위원회다."
1364,"중개 의뢰인이 특정한 중개업자에게 부동산을 독점적으로 중개의뢰하는 계약을 말한다. 독점중개의뢰계약이 다른 중개계약과 특별히 다른 점은 판매를 의뢰받은 중개업자에게 보수가 보장되는 데 있다. 중개의뢰인이 계약기간 내에 매도인을 발견하여 부동산을 구입한다 하더라도 중개업자에게는 보수를 지급하여야 한다. 독점판매권(獨占販賣權)을 획득한 중개업자는 보수가 획득될 가망성이 높기 때문에 모든 노력을 기울이며, 다른 중개업자에게도 협력하여 판매할 것을 의뢰하고 보수를 나누어 획득하기도 한다. 장래의 보수가 보장된다는 점에서 중개업자에게는 이 계약이 가장 유리하고, 의뢰인은 반대로 불리하다."
1365,"개인이나 법인이 일정한 기간에 얻은 재산에 대하여 부과하는 조세의 총칭이며 사람이 수입을 얻고 있다는 사실에 착안하여 과세하는 조세를 말한다. 법인세, 소득세·재평가세·부당이득세 등이 있다."
1366,"기회비용의 원칙은 부동산활동에서도 적용할 수 있다. 부동산 가격도 일반 경제이론처럼 희생된 대가를 계산할 수 있기 때문이다. 지금 투자한 대안의 가치를 다른 투자를 포기한, 즉 희생한 기회와 비교하여 구할 수 있다는 원칙이다. 감정평가이론으로써 기회비용의 원칙은 우리나라나 일본에서는 부동산가격의 11개 원칙에 포함시키지 않고 대체의 원칙과 관련하여 설명하고 있으나, 미국에서 최근에 추가시켰다."
1367,"광장·공원·녹지·유원지·공공공지 등 건물이 없는 공개 공간을 말한다. 공간시설은 주로 주민들의 복지나 오락 및 휴양, 경관의 유지, 환경보호를 목적으로 하는 시설이다. 국토의 계획 및 이용에 관한 법률에 정해 놓은 용어다."
1368,"부동산 평가의 분류상 업무기술상의 분류중 하나로 과거의 특정시점을 가격시점으로 하여 대상물건의 가격을 평가하는 것을 말한다. 원칙적으로 감정평가에 있어 가격시점은 가격조사 완료일이므로 소급평가는 예외적으로 인정된다. 소급평가는 기한부 평가와 마찬가지로 자료수집 및 감정평가 기법 상 어려움은 있으나 감정평가에 관한 규칙에서는 가격시점이 미리 정하여진 때에는 가격조사가 가능한 경우에 한하여 그 일자를 가격시점으로 할 수 있다고 하여 소급평가를 허용하고 있다. 소급평가는 토지수용과 관련한 보상평가, 민·형사상 재판의 증거 등에 사용된다."
1369,"새로 조성된 토지와 지적공부에 등록되어 있지 않은 토지를 지적공부에 등록하는 것을 말한다. 즉, 이미 비치된 지적공부에 등록하지 아니한 토지, 공유수면 매립지나 등록되지 않는 섬 등이 신규 등록의 대상이 된다. 토지소유자는 신규 등록할 토지가 있으면 그 사유가 발생한 날부터 60일 이내에 지적소관청에 신규 등록을 신청하여야 한다. 토지소유자를 정리할 경우 신규 등록은 지적소관청이 직접 조사하여 등록한다. 근거법은 공간정보의 구축 및 관리 등에 관한 법률이다."
1370,"수증자에게 일정한 법률상의 의무를 지우는 유증을 말한다. 예를 들어 “내가 죽은 후에 내 아내를 돌봐주면 A 건물을 주겠다”라고 하는 것이 부담부유증이다. 부담이 있는 유증을 받은 사람은 유증의 목적의 가액을 초과하지 않은 한도에서 부담한 의무를 이행할 책임이 있으나, 유증의 목적의 가액이 한정승인 또는 재산분리로 인하여 감소된 때에는 수증자는 그 감소된 한도에서 부담할 의무를 면하게 된다. 부담이 있는 유증을 받은 사람이 부담의무를 이행하지 않은 때는 상속인 또는 유언집행자는 상당한 기간을 정하여 이행할 것을 최고하고 그 기간 내에 이행하지 않은 때에는 법원에 유언의 취소를 청구할 수 있으나, 제3자의 이익을 해할 순 없다. 부담부 유증의 취소는 상속개시지의 가정법원에 청구하며, 취소의 심판절차에는 수증자가 참가해야 한다. 취소의 심판에 대해 수증자 그 밖의 이해관계인은 즉시항고를 할 수 있다. 부담부 유증의 취소심판이 확정되면 부담부 유증은 처음부터 존재하지 않았던 것으로 보고 수증자가 받았을 재산은 상속인에게 다시 귀속된다. 이미 수증자가 유증을 통해 재산상 이익을 얻었을 경우에는 부당이득반환의무를 부담하게 되나 취소 전에 유증의 목적물을 매수한 사람 등 제3자의 권리는 보호된다. 근거법은 민법, 가사소송법이다."
1371,"부동산 감정평가 시 감정평가사가 이론적 근거로 삼는 부동산가격의 원칙 중 하나로, 부동산의 가격은 대체가능한 다른 부동산이나 재화의 가격과 상호 관련되어 형성된다는 원칙이다. 부동산은 개별성의 특성이 있어, 엄격한 의미에서는 대체가 불가능하지만, 그 유용성의 측면에서는 가능하다. 이를 대체의 원칙이라 한다. 대체는 용도와 유용성, 그리고 가격이 유사해야 한다. 이를 대체의 세 가지 조건이라 한다. 또한 대체는 부동산 상호간에만 성립되는 것이 아니라, 지역과 지역 상호간에도 성립되며 부동산과 일반재화 사이에서도 성립될 수 있다."
1372,"예금이나 보험을 취급하는 금융기관이 자금을 조달하여 주택자금 수요자에게 대출해주고, 그 대신에 주택저당 채권을 획득하는 대출자와 차입자간의 관계만으로 형성되어 미분화된 금융시장 구조를 말한다. 1차 주택저당 대출시장이라고도 하며 주택금융이 발달하지 않은 국가의 주택금융 구조다."
1373,"한 사람의 채무자에게 많은 채권자가 있을 때 그 채권자들은 채무자의 총재산을 나누어 평등하게 변제받는 것을 말하며, 그 채권발생의 원인 또는 채권발생 시기의 전후에 따라서 채권의 효력에 차별을 두지 않는다는 원칙이다."
1374,주로 직업이나 취향을 중심으로 구성원을 모집하여 결성된 조합을 바탕으로 토지를 공동구매하고 공동사업으로 파격적인 원가절감을 이루면서도 구성원의 취향에 맞는 집을 짓는 방식을 말한다. 동호인 주택은 사업대상지역에 따라 도심형 동호인 주택과 전원형 동호인 주택으로 분류할 수 있다.
1375,"지리 조건으로 지역성을 포착하는 것이며, 중심성(中心性)에 입각하여 도시의 흡인력과 주변과 관계, 소매 및 서비스업 제 활동의 밀집·위치·규모·성격·가격으로 나타나는 여러 가지 특성을 지표상에서 포착하는 것이다. 상권측정은 최종적으로 지도화(mapping)하여 지도상에 구체적인 시장을 표시하여 끝낸다. 상권의 측정방법(商圈測定法)은 지역개념으로서 동질지역, 분극지역, 계획지역이라고 하는 세 가지 분류와 지역성으로써 보편성, 개별성, 연대성의 세 가지 특성에 따라 정리할 수 있다. 상권측정법은 그 지역에 사는 세대와 소재하는 상점을 대표하는 샘플을 추출하여 면접(面接)한 후 상권을 측정하는 현지조사법(現地調査法), 기존통계(旣存統計)를 분석해서 시장의 지역성을 포착하고, 그 지역성을 기초로 상권의 특성을 추계(推計)하는 통계분석법(統計分析法), 경험으로 얻은 연구(經驗的 硏究) 결론을 수식화 하여 일반 이론으로 발전시킨 수학적 분석법(數學的分析法) 등의 기술적인 방법이 있다. 수학적 분석법에는 레일리(Reilley)의 소매중력법칙, 컨버스(Converse)의 상권분기점, 허프 모형(Huff model) 등이 있다."
1376,지적공부에 등록된 1필지를 2필지 이상으로 나누어 등록하는 것을 말한다. 토지소유자는 토지를 분할하려면 대통령령으로 정하는 바에 따라 지적소관청에 분할을 신청해야 한다. 그리고 토지소유자는 지적공부에 등록된 1필지의 일부가 형질변경 등으로 용도가 변경된 경우에는 대통령령으로 정하는 바에 따라 용도가 변경된 날부터 60일 이내에 지적소관청에 토지의 분할을 신청해야 한다. 근거법은 측량·수로조사 및 지적에 관한 법률이다.
1377,"

모빌홈
부동산용어사전

미국에서 발달된 이동주택이다. 부엌, 화장실 기타 편리한 설비를 가진 공장생산주택으로 자동차나 트럭에 연결해 이동 가능한 것을 말한다. 이러한 주택의 편의를 위해 미국 정부는 모빌 홈 주차용 공원을 전국에 설치했다. 젊은이는 물론 은퇴한 노부부도 명승지를 주유(周遊)하는데 많이 이용한다.
외국어 표기 mobile home(영어), trailer(영어)

"
1378,"교통운수를 목적으로 하여 일정한 궤도 등의 설비와 형태를 갖추어 이용되는 토지와 이에 접속된 역사, 차고, 발전시설 및 공작창 등 부속시설물의 부지를 말한다."
1379,"두 도시가 있는 경우에 그 중간에 위치하고 있는 도시에서 유인하고 있는 구매력의 비율은 두 도시의 인구에 비례하고 거리의 제곱에 반비례한다는 법칙을 말한다. 레일리의 이것은 만유인력의 법칙을 원용한 것이다.레일리의 법칙의 수식은 다음과 같다.여기서 Ba : A도시가 중간의 C도시에서 흡수하는 상권범위, Bb : B도시가 중간의 C도시에서 흡수하는 상권범위, Pa : A도시의 인구, Pb : B도시의 인구, Da : 중간의 C도시에서 A도시까지의 거리, Db : 중간의 C도시에서 B도시까지의 거리이다."
